{
  "kind": "scip-query-plan-contract",
  "schemaVersion": 1,
  "planId": "SQP-BB1236038C8CB62F2720A7ACC8BF3CC6",
  "collaborationDomainId": "5ea57d1a-936c-4c91-b58f-5d61e45173a5",
  "goalId": "SQG-12532F1CFF0F0B84E98440E9BC3D352D",
  "changeId": "SQC-1A2415329C13102CED863257667AA0DE",
  "workflowClass": "sustained",
  "affectedSeeds": [
    {
      "id": "agent-setup",
      "kind": "symbol",
      "referent": "setupAgent",
      "role": "repository instruction installer"
    },
    {
      "id": "cli-preflight",
      "kind": "symbol",
      "referent": "prepareWorktreeIndex",
      "role": "evidence-command index preflight"
    },
    {
      "id": "plan-compiler",
      "kind": "symbol",
      "referent": "applyPlanContract",
      "role": "durable plan compiler"
    },
    {
      "id": "planning-packet",
      "kind": "symbol",
      "referent": "planContext",
      "role": "composite pre-edit evidence owner"
    }
  ],
  "preserve": [
    {
      "id": "fresh-evidence",
      "condition": "Compiler graph claims use a source-fresh generation",
      "evidenceIds": [
        "freshness-tests",
        "gate"
      ]
    },
    {
      "id": "output-contracts",
      "condition": "Programmatic JSON output retains its stable contract",
      "evidenceIds": [
        "api",
        "cli-tests"
      ]
    },
    {
      "id": "record-compatibility",
      "condition": "Existing full plan inputs and stored records remain compatible",
      "evidenceIds": [
        "api",
        "plan-tests"
      ]
    }
  ],
  "retirements": [
    {
      "id": "full-skill-preload",
      "condition": "Main skills contain only ordinary-path actions and precise conditional pointers",
      "evidenceIds": [
        "skill-tests"
      ],
      "kind": "responsibility",
      "referent": "preloading final-stage and rare protocol instructions",
      "responsibility": "loading instructions before they can affect a decision"
    },
    {
      "id": "manual-freshness-loop",
      "condition": "Ordinary evidence instructions no longer require status polling or manual reindex",
      "evidenceIds": [
        "freshness-tests",
        "skill-tests"
      ],
      "kind": "responsibility",
      "referent": "agent-managed status wait reindex loop",
      "responsibility": "making the model operate index freshness"
    }
  ],
  "allowedSurvivors": [],
  "reuseAuthorities": [],
  "architecture": [
    {
      "id": "architecture",
      "condition": "The configured architecture policy remains clean",
      "evidenceIds": [
        "gate"
      ],
      "predicate": "configured-policy-clean"
    }
  ],
  "completionEvidence": [
    {
      "id": "api",
      "description": "Run build, type checking, and public API checks"
    },
    {
      "id": "cli-tests",
      "description": "Run planning renderer and CLI contract tests"
    },
    {
      "id": "freshness-tests",
      "description": "Run CLI context, watch service, hook lease, and transparent freshness tests"
    },
    {
      "id": "gate",
      "description": "Run the configured final diff gate once"
    },
    {
      "id": "plan-tests",
      "description": "Run plan contract decoder, compiler, storage, and compatibility tests"
    },
    {
      "id": "skill-tests",
      "description": "Run generated skill, setup, link, and instruction-size checks"
    }
  ],
  "slices": [
    {
      "id": "freshness",
      "outcome": "Evidence commands internally obtain one fresh generation without model polling",
      "evidenceIds": [
        "freshness-tests"
      ],
      "dependsOn": []
    },
    {
      "id": "planning",
      "outcome": "One compact plan-context packet replaces repeated graph and source enumeration",
      "evidenceIds": [
        "cli-tests"
      ],
      "dependsOn": [
        "freshness"
      ]
    },
    {
      "id": "contract",
      "outcome": "Concise plan input compiles into the existing complete durable record",
      "evidenceIds": [
        "api",
        "plan-tests"
      ],
      "dependsOn": [
        "planning"
      ]
    },
    {
      "id": "skills",
      "outcome": "Ordinary agent instructions are short and omit freshness and premature verification ceremony",
      "evidenceIds": [
        "skill-tests"
      ],
      "dependsOn": [
        "contract"
      ]
    },
    {
      "id": "verification",
      "outcome": "The complete efficiency change passes public contracts and the final gate",
      "evidenceIds": [
        "api",
        "gate"
      ],
      "dependsOn": [
        "skills"
      ]
    }
  ],
  "source": {
    "path": "docs/plans/2026-08-01-token-efficient-agent-workflow.md",
    "sha256": "218c985074a5fbeb207ae4a36cc84c12ed7b34f9256d7e5e19c70296a7de3dd1"
  },
  "compiledAgainst": {
    "schemaVersion": 2,
    "observedAt": "2026-08-02T00:16:32.383Z",
    "facts": {
      "collaborationDomain": {
        "schemaVersion": 1,
        "canonicalizationVersion": 1,
        "hashAlgorithm": "sha256",
        "projection": {
          "name": "scip-query:collaboration-domain",
          "version": 1
        },
        "digest": "65fa7070a947c694f38de6708f2444d2bc2642785dcdb898d24a0401b41fb3c3"
      },
      "workspaceInstance": {
        "schemaVersion": 1,
        "canonicalizationVersion": 1,
        "hashAlgorithm": "sha256",
        "projection": {
          "name": "scip-query:workspace-instance",
          "version": 1
        },
        "digest": "f53b738aebdbca65df7f5d79a4bfc01cb854528c2a00705171682a625937c0c4"
      },
      "wholeContent": {
        "schemaVersion": 1,
        "canonicalizationVersion": 1,
        "hashAlgorithm": "sha256",
        "projection": {
          "name": "scip-query:repository-content",
          "version": 1
        },
        "digest": "cd78e9432c640b00100027acb3ade3babbb142b73b4edb2cbde906fef29479f3"
      },
      "relevantInputs": [
        {
          "subject": "scip-query:index-inputs",
          "identity": {
            "schemaVersion": 1,
            "canonicalizationVersion": 1,
            "hashAlgorithm": "sha256",
            "projection": {
              "name": "scip-query:index-inputs",
              "version": 2
            },
            "digest": "008a80b60492ab5f778ec217459fd4928e04cafb9f7f1e7a9359247ea74605b3"
          }
        }
      ]
    },
    "observedSources": [
      {
        "kind": "repository-snapshot",
        "identity": {
          "schemaVersion": 1,
          "canonicalizationVersion": 1,
          "hashAlgorithm": "sha256",
          "projection": {
            "name": "scip-query:repository-content",
            "version": 1
          },
          "digest": "cd78e9432c640b00100027acb3ade3babbb142b73b4edb2cbde906fef29479f3"
        }
      }
    ],
    "stabilityProofs": [
      {
        "source": "repository-snapshot",
        "kind": "fixed-snapshot"
      }
    ],
    "diagnostics": {
      "clean": false,
      "headCommit": "075e6d93bd8690a7433bceadc6582b1ad09daf8a",
      "treeOid": "dafd1a959b789e44b6caa38bea85f157ae4b0491"
    }
  },
  "semanticIdentity": {
    "algorithm": "sha256",
    "canonicalizationVersion": 1,
    "digest": "bb1236038c8cb62f2720a7acc8bf3cc6cfc64a688cb3a033defe0e8aa7b6cb36"
  },
  "createdAt": "2026-08-02T00:16:32.384Z",
  "writer": {
    "tool": "scip-query",
    "version": "0.20.0"
  }
}
